{
  "schema_version": "0.1.0",
  "claim_id": "claim_workspace_readonly_diagnostics_completed_demo",
  "claim_type": "observation",
  "statement": "A governed read-only diagnostic export completed successfully under a valid scoped capability.",
  "subject_ref": {
    "ref_type": "workspace_operation",
    "ref_id": "op_readonly_diagnostics_demo"
  },
  "perspective": {
    "observer": "agent_workspace_operator",
    "org_vertex": "workspace_operations",
    "industry_context": "platform_operations",
    "decision_job": "runtime_validation"
  },
  "confidence": 1.0,
  "evidence_ids": [
    "receipt_workspace_diagnostics_completed_demo",
    "evidence_workspace_operation_request_demo"
  ],
  "source_ids": [
    "SRC-0006"
  ],
  "receipt_ids": [
    "receipt_workspace_diagnostics_completed_demo"
  ],
  "operation_ids": [
    "op_readonly_diagnostics_demo"
  ],
  "capability_ids": [
    "cap_local_command_readonly_demo"
  ],
  "policy_boundary": "readonly_diagnostics",
  "status": "supported",
  "contradiction_status": "not_checked",
  "created_at": "2026-06-04T00:00:10Z"
}
